{
  "schema_version": "1.0.0",
  "reason_id": "U99.01",
  "review_state": "reviewed",
  "reviewed_at": "2026-07-21T12:00:00.000Z",
  "source_ids": ["review:synthetic-case"],
  "limitations": ["Synthetic card used to verify the contract. It is not part of the real catalog."],
  "observable_implication": "The observed attempt contains the distinction specified by this synthetic card.",
  "prerequisites": [
    {
      "id": "viable-start",
      "label": "A viable starting route existed",
      "accepted_evidence_kinds": ["product_data", "direct_observation"]
    }
  ],
  "nearest_lookalike_reason_ids": ["U99.02"],
  "accepted_evidence_kinds": ["direct_observation"]
}
